<?xml version="1.0" encoding="UTF-8"?>
<xs:schema xmlns:xs="http://www.w3.org/2001/XMLSchema" elementFormDefault="qualified"> 
    <xs:element name="figurenverzeichnis">
        <xs:complexType>
            <xs:sequence>
                
                <xs:element name="figur" maxOccurs="unbounded">
                    <xs:complexType>
                        <xs:sequence>
                            
                            <xs:element name="bezeichnung">
                                <xs:complexType>
                                    <xs:sequence>
                                        <xs:element name="name" type="xs:string"/>
                                        <xs:element name="nachname" type="xs:string" minOccurs="0" default=""/>
                                        <xs:element name="alias" type="xs:string" minOccurs="0" maxOccurs="unbounded"/>
                                    </xs:sequence>
                                </xs:complexType>
                            </xs:element>
                            
                            <xs:element name="category">
                                <xs:simpleType>
                                    <xs:restriction base="xs:string">
                                        <xs:enumeration value="Hauptfigur"/>
                                        <xs:enumeration value="Nebenfigur"/>
                                    </xs:restriction>
                                </xs:simpleType>
                            </xs:element>
                            
                            <xs:element name="age" minOccurs="0">
                                <xs:simpleType>
                                    <xs:restriction base="xs:integer">
                                        <xs:minInclusive value="0"/>
                                    </xs:restriction>
                                </xs:simpleType>
                            </xs:element>
                            
                            <xs:element name="planetoforigin" type="xs:string" minOccurs="0"/>
                            <xs:element name="species" type="xs:string" minOccurs="0"/>
                            
                            <xs:element name="firstseen">
                                <xs:complexType>
                                    <xs:sequence>
                                        <xs:element name="episodename" type="xs:string"/>
                                        <xs:element name="season">
                                            <xs:simpleType>
                                                <xs:restriction base="xs:integer">
                                                    <xs:minInclusive value="1"/>
                                                    <xs:maxInclusive value="2"/>
                                                </xs:restriction>
                                            </xs:simpleType>
                                        </xs:element>
                                        <xs:element name="episode">
                                            <xs:simpleType>
                                                <xs:restriction base="xs:integer">
                                                    <xs:minInclusive value="1"/>
                                                    <xs:maxInclusive value="11"/>
                                                </xs:restriction>
                                            </xs:simpleType>
                                        </xs:element>
                                    </xs:sequence>
                                </xs:complexType>
                            </xs:element>
                            
                            <xs:element name="beschreibung">
                                <xs:simpleType>
                                    <xs:restriction base="xs:string">
                                        <xs:minLength value="1"/>
                                    </xs:restriction>
                                </xs:simpleType>
                            </xs:element>
                            
                            <xs:element name="picture" type="xs:anyURI"/>
                        </xs:sequence>
                        <xs:attribute name="id" type="xs:ID" use="required"/>
                    </xs:complexType>

                </xs:element>
                
            </xs:sequence>
        </xs:complexType>
    </xs:element>
</xs:schema>
